{
  "schemaVersion": 1,
  "kind": "theme",
  "id": "hsbc-light",
  "name": "HSBC Light",
  "level": "core",
  "tokens": {
    "colour-primary": "#db0011",
    "colour-background": "#ffffff",
    "colour-text": "#1f1f1f",
    "radius-card": "1.25rem",
    "space-page": "2rem"
  },
  "assets": {
    "brand-logo": "hsbc-red"
  }
}
