{
  "schemaVersion": 1,
  "kind": "theme",
  "id": "hsbc-light",
  "name": "HSBC Light",
  "description": "Restrained light project theme inspired by the requested HSBC visual direction. This is not an official HSBC brand theme.",
  "level": "core",
  "tokens": {
    "colour-primary": "#db0011",
    "colour-primary-hover": "#b3000e",
    "colour-primary-soft": "#fff1f2",
    "colour-background": "#ffffff",
    "colour-surface": "#ffffff",
    "colour-surface-subtle": "#f7f7f7",
    "colour-text": "#1f1f1f",
    "colour-text-muted": "#5f5f5f",
    "colour-border": "#d8d8d8",
    "colour-border-strong": "#b8b8b8",
    "colour-focus": "#0066cc",
    "colour-positive": "#237804",
    "colour-positive-soft": "#f0f8ec",
    "colour-warning": "#8a5a00",
    "colour-warning-soft": "#fff7e6",
    "colour-critical": "#b42318",
    "colour-critical-soft": "#fff1f0",
    "colour-information": "#175cd3",
    "colour-information-soft": "#eff8ff",
    "font-family": "Inter, Arial, Helvetica, system-ui, -apple-system, BlinkMacSystemFont, \"Segoe UI\", sans-serif",
    "font-size-xs": "0.75rem",
    "font-size-sm": "0.875rem",
    "font-size-md": "1rem",
    "font-size-lg": "1.25rem",
    "font-size-xl": "1.75rem",
    "font-size-2xl": "2.5rem",
    "font-weight-regular": "400",
    "font-weight-medium": "600",
    "font-weight-bold": "700",
    "line-height-tight": "1.15",
    "line-height-body": "1.5",
    "space-1": "0.25rem",
    "space-2": "0.5rem",
    "space-3": "0.75rem",
    "space-4": "1rem",
    "space-5": "1.5rem",
    "space-6": "2rem",
    "space-7": "3rem",
    "radius-sm": "0.25rem",
    "radius-md": "0.5rem",
    "radius-lg": "0.75rem",
    "shadow-sm": "0 1px 2px rgba(0, 0, 0, 0.08)",
    "shadow-md": "0 8px 24px rgba(0, 0, 0, 0.10)",
    "content-max-width": "90rem"
  },
  "assets": {
    "brand-logo": "mydash-brand-mark"
  }
}
